{
  "RegistryPaths": {
    "ExplorerAdvanced": "HKCU:\\Software\\Microsoft\\Windows\\CurrentVersion\\Explorer\\Advanced",
    "Explorer": "HKCU:\\Software\\Microsoft\\Windows\\CurrentVersion\\Explorer",
    "ExplorerCabinetState": "HKCU:\\Software\\Microsoft\\Windows\\CurrentVersion\\Explorer\\CabinetState",
    "ExplorerVisualEffects": "HKCU:\\Software\\Microsoft\\Windows\\CurrentVersion\\Explorer\\VisualEffects",
    "Search": "HKCU:\\Software\\Microsoft\\Windows\\CurrentVersion\\Search",
    "AdvertisingInfo": "HKCU:\\Software\\Microsoft\\Windows\\CurrentVersion\\AdvertisingInfo",
    "ContentDeliveryManager": "HKCU:\\Software\\Microsoft\\Windows\\CurrentVersion\\ContentDeliveryManager",
    "GameBar": "HKCU:\\Software\\Microsoft\\GameBar",
    "DataCollection": "HKLM:\\SOFTWARE\\Policies\\Microsoft\\Windows\\DataCollection",
    "DataCollectionUser": "HKLM:\\SOFTWARE\\Microsoft\\Windows\\CurrentVersion\\Policies\\DataCollection",
    "SystemPolicies": "HKLM:\\SOFTWARE\\Policies\\Microsoft\\Windows\\System",
    "WindowsSearch": "HKLM:\\SOFTWARE\\Policies\\Microsoft\\Windows\\Windows Search",
    "CloudContent": "HKLM:\\SOFTWARE\\Policies\\Microsoft\\Windows\\CloudContent",
    "TcpipParameters": "HKLM:\\SYSTEM\\CurrentControlSet\\Services\\Tcpip\\Parameters",
    "QoSPolicies": "HKLM:\\SOFTWARE\\Policies\\Microsoft\\Windows\\Psched",
    "DeveloperMode": "HKLM:\\SOFTWARE\\Microsoft\\Windows\\CurrentVersion\\AppModelUnlock",
    "LibrariesClsid": "HKCU:\\Software\\Classes\\CLSID\\{031E4825-7B94-4dc3-B131-E946B44C8DD5}"
  },
  "RegistryValues": {
    "Explorer": {
      "Hidden": {
        "Name": "Hidden",
        "Path": "ExplorerAdvanced",
        "Type": "DWord",
        "ValueEnabled": 1,
        "ValueDisabled": 0
      },
      "HideFileExt": {
        "Name": "HideFileExt",
        "Path": "ExplorerAdvanced",
        "Type": "DWord",
        "ValueEnabled": 0,
        "ValueDisabled": 1,
        "Comment": "0 = show extensions (enabled), 1 = hide extensions (disabled)"
      },
      "NavPaneShowAllFolders": {
        "Name": "NavPaneShowAllFolders",
        "Path": "ExplorerAdvanced",
        "Type": "DWord",
        "ValueEnabled": 1,
        "ValueDisabled": 0
      },
      "NavPaneExpandToCurrentFolder": {
        "Name": "NavPaneExpandToCurrentFolder",
        "Path": "ExplorerAdvanced",
        "Type": "DWord",
        "ValueEnabled": 1,
        "ValueDisabled": 0
      },
      "ShowSyncProviderNotifications": {
        "Name": "ShowSyncProviderNotifications",
        "Path": "ExplorerAdvanced",
        "Type": "DWord",
        "ValueEnabled": 1,
        "ValueDisabled": 0
      },
      "ShowStatusColumn": {
        "Name": "ShowStatusColumn",
        "Path": "Explorer",
        "Type": "DWord",
        "ValueEnabled": 1,
        "ValueDisabled": 0
      },
      "FullPath": {
        "Name": "FullPath",
        "Path": "ExplorerCabinetState",
        "Type": "DWord",
        "ValueEnabled": 1,
        "ValueDisabled": 0
      },
      "SeparateProcess": {
        "Name": "SeparateProcess",
        "Path": "ExplorerAdvanced",
        "Type": "DWord",
        "ValueEnabled": 1,
        "ValueDisabled": 0
      },
      "IsPinnedToNameSpaceTree": {
        "Name": "System.IsPinnedToNameSpaceTree",
        "Path": "LibrariesClsid",
        "Type": "DWord",
        "ValueEnabled": 1,
        "ValueDisabled": 0
      }
    },
    "Taskbar": {
      "TaskbarDa": {
        "Name": "TaskbarDa",
        "Path": "ExplorerAdvanced",
        "Type": "DWord",
        "ValueEnabled": 1,
        "ValueDisabled": 0,
        "Comment": "Widgets: 1 = show (enabled), 0 = hide (disabled)"
      },
      "TaskbarAl": {
        "Name": "TaskbarAl",
        "Path": "ExplorerAdvanced",
        "Type": "DWord",
        "ValueLeft": 0,
        "ValueCenter": 1
      },
      "ShowTaskViewButton": {
        "Name": "ShowTaskViewButton",
        "Path": "ExplorerAdvanced",
        "Type": "DWord",
        "ValueEnabled": 1,
        "ValueDisabled": 0
      },
      "TaskbarMn": {
        "Name": "TaskbarMn",
        "Path": "ExplorerAdvanced",
        "Type": "DWord",
        "ValueEnabled": 1,
        "ValueDisabled": 0,
        "Comment": "Chat icon: 1 = show (enabled), 0 = hide (disabled)"
      }
    },
    "Search": {
      "SearchboxTaskbarMode": {
        "Name": "SearchboxTaskbarMode",
        "Path": "Search",
        "Type": "DWord",
        "ValueHidden": 0,
        "ValueIconOnly": 1,
        "ValueBox": 2
      },
      "CortanaConsent": {
        "Name": "CortanaConsent",
        "Path": "Search",
        "Type": "DWord",
        "ValueEnabled": 1,
        "ValueDisabled": 0
      }
    },
    "Privacy": {
      "AllowTelemetry": {
        "Name": "AllowTelemetry",
        "Path": "DataCollection",
        "Type": "DWord",
        "ValueEnabled": 1,
        "ValueDisabled": 0,
        "Comment": "Telemetry: 0 = disabled, 1 = enabled"
      },
      "AllowTelemetryUser": {
        "Name": "AllowTelemetry",
        "Path": "DataCollectionUser",
        "Type": "DWord",
        "ValueEnabled": 1,
        "ValueDisabled": 0
      },
      "AdvertisingEnabled": {
        "Name": "Enabled",
        "Path": "AdvertisingInfo",
        "Type": "DWord",
        "ValueEnabled": 1,
        "ValueDisabled": 0
      },
      "StartTrackProgs": {
        "Name": "Start_TrackProgs",
        "Path": "ExplorerAdvanced",
        "Type": "DWord",
        "ValueEnabled": 1,
        "ValueDisabled": 0
      },
      "SubscribedContent338393": {
        "Name": "SubscribedContent-338393Enabled",
        "Path": "ContentDeliveryManager",
        "Type": "DWord",
        "ValueEnabled": 1,
        "ValueDisabled": 0
      },
      "SubscribedContent353694": {
        "Name": "SubscribedContent-353694Enabled",
        "Path": "ContentDeliveryManager",
        "Type": "DWord",
        "ValueEnabled": 1,
        "ValueDisabled": 0
      },
      "SubscribedContent338389": {
        "Name": "SubscribedContent-338389Enabled",
        "Path": "ContentDeliveryManager",
        "Type": "DWord",
        "ValueEnabled": 1,
        "ValueDisabled": 0
      },
      "EnableActivityFeed": {
        "Name": "EnableActivityFeed",
        "Path": "SystemPolicies",
        "Type": "DWord",
        "ValueEnabled": 1,
        "ValueDisabled": 0
      },
      "PublishUserActivities": {
        "Name": "PublishUserActivities",
        "Path": "SystemPolicies",
        "Type": "DWord",
        "ValueEnabled": 1,
        "ValueDisabled": 0
      },
      "AllowCortana": {
        "Name": "AllowCortana",
        "Path": "WindowsSearch",
        "Type": "DWord",
        "ValueEnabled": 1,
        "ValueDisabled": 0
      },
      "DisableWindowsConsumerFeatures": {
        "Name": "DisableWindowsConsumerFeatures",
        "Path": "CloudContent",
        "Type": "DWord",
        "ValueEnabled": 1,
        "ValueDisabled": 0,
        "Comment": "1 = consumer features disabled"
      },
      "SilentInstalledAppsEnabled": {
        "Name": "SilentInstalledAppsEnabled",
        "Path": "ContentDeliveryManager",
        "Type": "DWord",
        "ValueEnabled": 1,
        "ValueDisabled": 0
      },
      "SystemPaneSuggestionsEnabled": {
        "Name": "SystemPaneSuggestionsEnabled",
        "Path": "ContentDeliveryManager",
        "Type": "DWord",
        "ValueEnabled": 1,
        "ValueDisabled": 0
      },
      "PreInstalledAppsEnabled": {
        "Name": "PreInstalledAppsEnabled",
        "Path": "ContentDeliveryManager",
        "Type": "DWord",
        "ValueEnabled": 1,
        "ValueDisabled": 0
      },
      "SoftLandingEnabled": {
        "Name": "SoftLandingEnabled",
        "Path": "ContentDeliveryManager",
        "Type": "DWord",
        "ValueEnabled": 1,
        "ValueDisabled": 0
      }
    },
    "Performance": {
      "VisualFXSetting": {
        "Name": "VisualFXSetting",
        "Path": "ExplorerVisualEffects",
        "Type": "DWord",
        "ValueBestPerformance": 2,
        "ValueBestAppearance": 1,
        "ValueCustom": 3
      },
      "AutoGameModeEnabled": {
        "Name": "AutoGameModeEnabled",
        "Path": "GameBar",
        "Type": "DWord",
        "ValueEnabled": 1,
        "ValueDisabled": 0
      }
    },
    "Network": {
      "TcpAckFrequency": {
        "Name": "TcpAckFrequency",
        "Path": "TcpipParameters",
        "Type": "DWord",
        "ValueOptimized": 1,
        "ValueDefault": 2
      },
      "TCPNoDelay": {
        "Name": "TCPNoDelay",
        "Path": "TcpipParameters",
        "Type": "DWord",
        "ValueOptimized": 1,
        "ValueDefault": 0
      },
      "NonBestEffortLimit": {
        "Name": "NonBestEffortLimit",
        "Path": "QoSPolicies",
        "Type": "DWord",
        "ValueOptimized": 0,
        "ValueDefault": 20
      }
    },
    "Security": {
      "AllowDevelopmentWithoutDevLicense": {
        "Name": "AllowDevelopmentWithoutDevLicense",
        "Path": "DeveloperMode",
        "Type": "DWord",
        "ValueEnabled": 1,
        "ValueDisabled": 0
      }
    }
  },
  "PowerPlans": {
    "HighPerformance": "8c5e7fda-e8bf-4a96-9a85-a6e23a8c635c",
    "Balanced": "381b4222-f694-41f0-9685-ff5bb260df2e",
    "PowerSaver": "a1841308-3541-4fab-bc81-f71556f20b4a"
  },
  "GUIDs": {
    "LibrariesNamespaceGuid": "{031E4825-7B94-4dc3-B131-E946B44C8DD5}"
  },
  "Services": {
    "ToDisable": [
      "MapsBroker",
      "lfsvc",
      "RetailDemo",
      "PhoneSvc",
      "Fax",
      "XblAuthManager",
      "XblGameSave",
      "XboxNetApiSvc",
      "XboxGipSvc",
      "WalletService",
      "WMPNetworkSvc"
    ],
    "ToManual": [
      "WSearch",
      "SysMain",
      "TrkWks",
      "WbioSrvc"
    ],
    "Telemetry": "DiagTrack"
  },
  "Timeouts": {
    "ExplorerRestartDelaySeconds": 2
  }
}
